{
  "$comment": "Hand-reviewed classification of the pinned upstream bin inventory and port helpers. Enforced by checks.omarchy-ledgers.",
  "pin": "v4.0.3",
  "upstream_rev": "0534987009061cbe2dacdde4ad564092ab698d12",
  "generated": false,
  "scripts": [
    {
      "id": "pacman",
      "class": "na",
      "upstream": "pacman",
      "stand_in": "schema/packages.map.json + nixos-rebuild",
      "user_visible": false,
      "reason": "pacman",
      "since_pin": "v4.0.2",
      "phase": "never",
      "notes": "Never install host pacman. Distrobox is fine for userspace Arch tools."
    },
    {
      "id": "omarchy",
      "class": "wrap",
      "upstream": "bin/omarchy",
      "stand_in": "pkgs/omarchy.nix",
      "user_visible": true,
      "since_pin": "v4.0.2",
      "phase": "v1",
      "notes": "Help copy made NixOS-honest via --replace-fail in pkgs/omarchy.nix (main help heredoc, GROUP_DESCRIPTIONS); routing/dispatch logic is upstream verbatim. oma-cli G1a."
    },
    {
      "id": "omarchy-agent",
      "class": "vendor",
      "upstream": "bin/omarchy-agent",
      "stand_in": null,
      "user_visible": true,
      "since_pin": "v4.0.2",
      "phase": "v1"
    },
    {
      "id": "omarchy-agent-crash",
      "class": "vendor",
      "upstream": "bin/omarchy-agent-crash",
      "stand_in": null,
      "user_visible": true,
      "since_pin": "v4.0.2",
      "phase": "v1"
    },
    {
      "id": "omarchy-agent-prompt",
      "class": "vendor",
      "upstream": "bin/omarchy-agent-prompt",
      "stand_in": null,
      "user_visible": true,
      "since_pin": "v4.0.2",
      "phase": "v1"
    },
    {
      "id": "omarchy-agent-usage-claude",
      "class": "vendor",
      "upstream": "bin/omarchy-agent-usage-claude",
      "stand_in": null,
      "user_visible": true,
      "since_pin": "v4.0.2",
      "phase": "v1"
    },
    {
      "id": "omarchy-agent-usage-codex",
      "class": "vendor",
      "upstream": "bin/omarchy-agent-usage-codex",
      "stand_in": null,
      "user_visible": true,
      "since_pin": "v4.0.2",
      "phase": "v1"
    },
    {
      "id": "omarchy-agent-usage-fireworks",
      "class": "vendor",
      "upstream": "bin/omarchy-agent-usage-fireworks",
      "stand_in": null,
      "user_visible": true,
      "since_pin": "v4.0.2",
      "phase": "v1"
    },
    {
      "id": "omarchy-agent-usage-update",
      "class": "vendor",
      "upstream": "bin/omarchy-agent-usage-update",
      "stand_in": null,
      "user_visible": true,
      "since_pin": "v4.0.2",
      "phase": "v1"
    },
    {
      "id": "omarchy-apply-hardware",
      "class": "stub",
      "upstream": "bin/omarchy-apply-hardware",
      "stand_in": "pkgs/omarchy.nix",
      "user_visible": false,
      "since_pin": "v4.0.2",
      "phase": "v1",
      "reason": "nixos-declarative",
      "notes": "Existing NixOS stand-in; declarative notes exit 0. The first output line is omahedron: stub: nixos-declarative (ADR-0009)."
    },
    {
      "id": "omarchy-apply-lock",
      "class": "stub",
      "upstream": "bin/omarchy-apply-lock",
      "stand_in": "pkgs/omarchy.nix",
      "user_visible": true,
      "since_pin": "v4.0.2",
      "phase": "v1",
      "reason": "nixos-declarative",
      "notes": "Existing NixOS stand-in; declarative notes exit 0. The first output line is omahedron: stub: nixos-declarative (ADR-0009)."
    },
    {
      "id": "omarchy-apply-system",
      "class": "stub",
      "upstream": "bin/omarchy-apply-system",
      "stand_in": "pkgs/omarchy.nix",
      "user_visible": false,
      "since_pin": "v4.0.2",
      "phase": "v1",
      "reason": "nixos-declarative",
      "notes": "Existing NixOS stand-in; declarative notes exit 0. The first output line is omahedron: stub: nixos-declarative (ADR-0009)."
    },
    {
      "id": "omarchy-audio-input-mute",
      "class": "vendor",
      "upstream": "bin/omarchy-audio-input-mute",
      "stand_in": null,
      "user_visible": true,
      "since_pin": "v4.0.2",
      "phase": "v1"
    },
    {
      "id": "omarchy-audio-input-set-default",
      "class": "vendor",
      "upstream": "bin/omarchy-audio-input-set-default",
      "stand_in": null,
      "user_visible": true,
      "since_pin": "v4.0.2",
      "phase": "v1"
    },
    {
      "id": "omarchy-audio-output-set-default",
      "class": "vendor",
      "upstream": "bin/omarchy-audio-output-set-default",
      "stand_in": null,
      "user_visible": true,
      "since_pin": "v4.0.2",
      "phase": "v1"
    },
    {
      "id": "omarchy-audio-output-sink",
      "class": "vendor",
      "upstream": "bin/omarchy-audio-output-sink",
      "stand_in": null,
      "user_visible": true,
      "since_pin": "v4.0.2",
      "phase": "v1"
    },
    {
      "id": "omarchy-audio-output-switch",
      "class": "vendor",
      "upstream": "bin/omarchy-audio-output-switch",
      "stand_in": null,
      "user_visible": true,
      "since_pin": "v4.0.2",
      "phase": "v1"
    },
    {
      "id": "omarchy-audio-output-volume",
      "class": "vendor",
      "upstream": "bin/omarchy-audio-output-volume",
      "stand_in": null,
      "user_visible": true,
      "since_pin": "v4.0.2",
      "phase": "v1"
    },
    {
      "id": "omarchy-audio-sink-availability",
      "class": "vendor",
      "upstream": "bin/omarchy-audio-sink-availability",
      "stand_in": null,
      "user_visible": true,
      "since_pin": "v4.0.2",
      "phase": "v1"
    },
    {
      "id": "omarchy-audio-source-switch",
      "class": "vendor",
      "upstream": "bin/omarchy-audio-source-switch",
      "stand_in": null,
      "user_visible": true,
      "since_pin": "v4.0.2",
      "phase": "v1"
    },
    {
      "id": "omarchy-audio-tuning",
      "class": "vendor",
      "upstream": "bin/omarchy-audio-tuning",
      "stand_in": null,
      "user_visible": true,
      "since_pin": "v4.0.2",
      "phase": "v1"
    },
    {
      "id": "omarchy-bar",
      "class": "vendor",
      "upstream": "bin/omarchy-bar",
      "stand_in": null,
      "user_visible": true,
      "since_pin": "v4.0.2",
      "phase": "v1"
    },
    {
      "id": "omarchy-bar-text-color",
      "class": "vendor",
      "upstream": "bin/omarchy-bar-text-color",
      "stand_in": null,
      "user_visible": true,
      "since_pin": "v4.0.2",
      "phase": "v1"
    },
    {
      "id": "omarchy-battery-low",
      "class": "vendor",
      "upstream": "bin/omarchy-battery-low",
      "stand_in": null,
      "user_visible": true,
      "since_pin": "v4.0.2",
      "phase": "v1"
    },
    {
      "id": "omarchy-battery-present",
      "class": "vendor",
      "upstream": "bin/omarchy-battery-present",
      "stand_in": null,
      "user_visible": true,
      "since_pin": "v4.0.2",
      "phase": "v1"
    },
    {
      "id": "omarchy-battery-status",
      "class": "vendor",
      "upstream": "bin/omarchy-battery-status",
      "stand_in": null,
      "user_visible": true,
      "since_pin": "v4.0.2",
      "phase": "v1"
    },
    {
      "id": "omarchy-bluetooth-device",
      "class": "vendor",
      "upstream": "bin/omarchy-bluetooth-device",
      "stand_in": null,
      "user_visible": true,
      "since_pin": "v4.0.2",
      "phase": "v1"
    },
    {
      "id": "omarchy-bluetooth-power",
      "class": "vendor",
      "upstream": "bin/omarchy-bluetooth-power",
      "stand_in": null,
      "user_visible": true,
      "since_pin": "v4.0.2",
      "phase": "v1"
    },
    {
      "id": "omarchy-branding-about",
      "class": "wrap",
      "upstream": "bin/omarchy-branding-about",
      "stand_in": "pkgs/omarchy.nix",
      "user_visible": true,
      "since_pin": "v4.0.2",
      "phase": "v1",
      "notes": "NixOS adaptation in pkgs/omarchy.nix; upstream command name retained."
    },
    {
      "id": "omarchy-branding-screensaver",
      "class": "wrap",
      "upstream": "bin/omarchy-branding-screensaver",
      "stand_in": "pkgs/omarchy.nix",
      "user_visible": true,
      "since_pin": "v4.0.2",
      "phase": "v1",
      "notes": "NixOS adaptation in pkgs/omarchy.nix; upstream command name retained."
    },
    {
      "id": "omarchy-brightness-display",
      "class": "vendor",
      "upstream": "bin/omarchy-brightness-display",
      "stand_in": null,
      "user_visible": true,
      "since_pin": "v4.0.2",
      "phase": "v1"
    },
    {
      "id": "omarchy-brightness-display-apple",
      "class": "vendor",
      "upstream": "bin/omarchy-brightness-display-apple",
      "stand_in": null,
      "user_visible": true,
      "since_pin": "v4.0.2",
      "phase": "v1"
    },
    {
      "id": "omarchy-brightness-display-ddc",
      "class": "vendor",
      "upstream": "bin/omarchy-brightness-display-ddc",
      "stand_in": null,
      "user_visible": true,
      "since_pin": "v4.0.2",
      "phase": "v1"
    },
    {
      "id": "omarchy-brightness-keyboard",
      "class": "vendor",
      "upstream": "bin/omarchy-brightness-keyboard",
      "stand_in": null,
      "user_visible": true,
      "since_pin": "v4.0.2",
      "phase": "v1"
    },
    {
      "id": "omarchy-brightness-keyboard-mute",
      "class": "vendor",
      "upstream": "bin/omarchy-brightness-keyboard-mute",
      "stand_in": null,
      "user_visible": true,
      "since_pin": "v4.0.2",
      "phase": "v1"
    },
    {
      "id": "omarchy-capture-qr",
      "class": "vendor",
      "upstream": "bin/omarchy-capture-qr",
      "stand_in": null,
      "user_visible": true,
      "since_pin": "v4.0.2",
      "phase": "v1"
    },
    {
      "id": "omarchy-capture-region",
      "class": "vendor",
      "upstream": "bin/omarchy-capture-region",
      "stand_in": null,
      "user_visible": true,
      "since_pin": "v4.0.2",
      "phase": "v1"
    },
    {
      "id": "omarchy-capture-screenrecording",
      "class": "wrap",
      "upstream": "bin/omarchy-capture-screenrecording",
      "stand_in": "pkgs/omarchy.nix",
      "user_visible": true,